{
  "$schema": "./schemas/downstream-patches.schema.json",
  "schema_version": "fiet-rindexer-downstream-patch-ledger/v1",
  "canonical": {
    "repository": "https://github.com/joshstevens19/rindexer",
    "tag": "v0.43.0",
    "commit": "4f441289b83855c357239d2729fb725a56c3060b",
    "tree": "80a2698f6be13949d84d920b01c02125af598d09"
  },
  "inventory": {
    "path": "downstream-patch-inventory.json",
    "canonical_sha256": "b260101a8f2afc33acb5557f4c56b62364b1cc4e890b753196867a16afb38dee"
  },
  "release": {
    "branch": "fiet/v0.43",
    "state": "candidate",
    "tag": null,
    "peeled_commit": null,
    "peeled_tree": null
  },
  "governed_paths": "governed-paths.json",
  "patches": [
    {
      "id": "outerlook-5583ca2-native-transfer-end-block",
      "title": "Bound native-transfer historical ranges",
      "owner": "usherlabs",
      "rationale": "Determine whether canonical v0.43 preserves explicitly bounded historical native-transfer scanning without changing Maker's live-only configuration policy.",
      "audit_disposition": "absorbed",
      "release_state": "inactive",
      "source": {
        "repository": "https://github.com/outerlook/rindexer",
        "branch": "fix/multi-indexed-filter",
        "commits": ["5583ca26e3c7422258a298e65cdbad36e7950fe1"]
      },
      "affected_paths": ["core/src/indexer/start.rs"],
      "affected_behaviors": ["bounded historical native-transfer block fetching"],
      "canonical_baseline": {
        "tag": "v0.43.0",
        "commit": "4f441289b83855c357239d2729fb725a56c3060b",
        "tree": "80a2698f6be13949d84d920b01c02125af598d09"
      },
      "requirement_ids": ["rindexer-indexing-integrity:native-transfer-engine-capability-and-maker-policy"],
      "regression_tests": [{"id": "native-transfer-range-audit", "path": "scripts/test_characterize_v043_baseline.py", "command": "python3 -m unittest scripts.test_characterize_v043_baseline.CharacterizeV043BaselineTests.test_stream_native_reorg_and_hypersync_baseline"}],
      "upstream": {"status": "not_applicable"},
      "evidence": [
        "characterization/v0.43/vanilla-baseline-receipt.json",
        "characterization observation native_transfer_supports_bounded_range=true",
        "canonical native_transfer_block_fetch clamps to end_block and completes only after the bounded range"
      ],
      "downstream_commits": [],
      "ancestry_markers": []
    },
    {
      "id": "outerlook-9d0efbf-native-transfer-channel-closure",
      "title": "Terminate closed native-transfer processor channels",
      "owner": "usherlabs",
      "rationale": "Determine whether canonical v0.43 terminates or reports a closed native-transfer processor channel instead of hanging silently.",
      "audit_disposition": "ported",
      "release_state": "active",
      "source": {"repository": "https://github.com/outerlook/rindexer", "branch": "fix/multi-indexed-filter", "commits": ["9d0efbf9872b08df778c530558bbb6ee4504cf3b"]},
      "affected_paths": ["core/src/indexer/native_transfer.rs"],
      "affected_behaviors": ["native-transfer processor-channel closure"],
      "canonical_baseline": {"tag": "v0.43.0", "commit": "4f441289b83855c357239d2729fb725a56c3060b", "tree": "80a2698f6be13949d84d920b01c02125af598d09"},
      "requirement_ids": ["rindexer-indexing-integrity:explicit-live-stream-completion-semantics"],
      "regression_tests": [{"id": "native-transfer-channel-closure", "path": "core/src/indexer/native_transfer.rs", "command": "cargo nextest run -p rindexer indexer::native_transfer::tests::native_transfer_block_processor_exits_when_input_channel_is_closed -- --exact"}],
      "upstream": {"status": "planned"},
      "evidence": [
        "characterization/v0.43/vanilla-baseline-receipt.json",
        "characterization observation native_processor_closed_channel_sleeps=true",
        "focused regression failed by timeout before a23ab7de52d32fb4abbb828fba5fb9a8aa784160 and passed after it",
        "native-transfer module regression suite: 16 passed, 0 failed"
      ],
      "downstream_commits": ["ce060993cd6be950c8d64ae7a1eda5293dea8375"],
      "ancestry_markers": ["FIET-PATCH:outerlook-9d0efbf-native-transfer-channel-closure"]
    },
    {
      "id": "outerlook-450ae49-multiple-indexed-filters",
      "title": "Evaluate every filter-mode indexed-filter alternative",
      "owner": "usherlabs",
      "rationale": "Determine whether canonical v0.43 evaluates later filter-mode alternatives instead of selecting only the first configured filter.",
      "audit_disposition": "ported",
      "release_state": "active",
      "source": {"repository": "https://github.com/outerlook/rindexer", "branch": "fix/multi-indexed-filter", "commits": ["450ae497280bf8efee3644a23a6241fbf37a47e0"]},
      "affected_paths": ["Cargo.lock", "core/src/event/contract_setup.rs", "core/src/event/rindexer_event_filter.rs", "core/src/manifest/contract.rs", "core/src/provider.rs"],
      "affected_behaviors": ["multiple filter-mode indexed-filter alternatives"],
      "canonical_baseline": {"tag": "v0.43.0", "commit": "4f441289b83855c357239d2729fb725a56c3060b", "tree": "80a2698f6be13949d84d920b01c02125af598d09"},
      "requirement_ids": ["rindexer-indexing-integrity:multiple-filter-mode-indexed-filters", "rindexer-indexing-integrity:maker-filter-shape-compatibility"],
      "regression_tests": [
        {"id": "filter-alternative-selection", "path": "core/src/event/rindexer_event_filter.rs", "command": "cargo nextest run -p rindexer new_filter_"},
        {"id": "filter-mode-manifest-retention", "path": "core/src/manifest/contract.rs", "command": "cargo nextest run -p rindexer filter_mode_setup_preserves_every_indexed_filter"},
        {"id": "ordered-rpc-filter-queries", "path": "core/src/provider.rs", "command": "cargo nextest run -p rindexer rpc_provider_queries_every_same_event_filter_alternative"},
        {"id": "filter-result-merge", "path": "core/src/provider.rs", "command": "cargo nextest run -p rindexer multiple_filter_results_"}
      ],
      "upstream": {"status": "planned"},
      "evidence": [
        "characterization/v0.43/vanilla-baseline-receipt.json",
        "characterization observation filter_mode_uses_only_first_indexed_filter=true",
        "same-event alternatives retain manifest order while unrelated event filters are excluded",
        "RPC queries are issued in alternative order and overlapping logs deduplicate only with complete block-hash, transaction-hash, and log-index identity",
        "Maker address-mode split-detail wallet filter shape remains unchanged",
        "combined candidate compile exposed the single-filter detail-key assumption and filter alternative detail-key regressions passed after 04bc9029e35aba3216f7669e6cd6e3aabab0b5d3",
        "cargo test -p rindexer --lib: 771 passed, 4 ignored",
        "cargo clippy -p rindexer --all-targets -- -D warnings"
      ],
      "downstream_commits": ["cc1c2f66f313e3ce4328cfbc37af4e6c62a30fb3", "04bc9029e35aba3216f7669e6cd6e3aabab0b5d3"],
      "ancestry_markers": ["FIET-PATCH:outerlook-450ae49-multiple-indexed-filters"]
    },
    {
      "id": "outerlook-3003dca-live-native-transfers",
      "title": "Run native transfers in the live pass",
      "owner": "usherlabs",
      "rationale": "Determine whether canonical v0.43 absorbs live native-transfer head following and catch-up-to-live transition behavior.",
      "audit_disposition": "absorbed",
      "release_state": "inactive",
      "source": {"repository": "https://github.com/outerlook/rindexer", "branch": "fix/multi-indexed-filter", "commits": ["3003dca5e79ccb1e7bd8886d48c921f5048171a8"]},
      "affected_paths": ["core/src/indexer/native_transfer.rs", "core/src/indexer/start.rs", "core/src/manifest/core.rs", "core/src/start.rs"],
      "affected_behaviors": ["live native-transfer indexing follows authoritative head"],
      "canonical_baseline": {"tag": "v0.43.0", "commit": "4f441289b83855c357239d2729fb725a56c3060b", "tree": "80a2698f6be13949d84d920b01c02125af598d09"},
      "requirement_ids": ["rindexer-indexing-integrity:native-transfer-engine-capability-and-maker-policy"],
      "regression_tests": [{"id": "live-native-transfer-audit", "path": "core/src/manifest/core.rs", "command": "cargo test -p rindexer manifest::core::tests::has_any_live_indexing_"}],
      "upstream": {"status": "not_applicable"},
      "evidence": [
        "characterization/v0.43/vanilla-baseline-receipt.json",
        "canonical Manifest::has_any_live_indexing includes enabled native-transfer networks without end_block",
        "canonical start_indexing_traces defers native transfers from the historical pass into the live pass",
        "canonical native-transfer live-indexing manifest regressions pass"
      ],
      "downstream_commits": [],
      "ancestry_markers": []
    },
    {
      "id": "outerlook-85b7dad-per-detail-cursors",
      "title": "Persist exact per-detail coverage cursors",
      "owner": "usherlabs",
      "rationale": "Establish exact stream-table, network, and detail-key durability across every progress path, including Bloom-negative ranges and restart.",
      "audit_disposition": "ported",
      "release_state": "active",
      "source": {"repository": "https://github.com/outerlook/rindexer", "branch": "fix/multi-indexed-filter", "commits": ["85b7dadf3c54f8a201e60b2ed7cb17389fd30da9"]},
      "affected_paths": ["core/src/database/clickhouse/client.rs", "core/src/database/clickhouse/generate.rs", "core/src/database/generate.rs", "core/src/database/postgres/client.rs", "core/src/event/callback_registry.rs", "core/src/event/config.rs", "core/src/indexer/last_synced.rs", "core/src/indexer/native_transfer.rs", "core/src/indexer/no_code.rs", "core/src/indexer/process.rs", "core/src/indexer/start.rs", "core/src/indexer/tables.rs"],
      "affected_behaviors": ["exact per-manifest-detail durable coverage", "Bloom-negative empty-block cursor persistence", "restart from exact detail progress"],